### ISSUE TITLE
multipart upload is broken

### ISSUE THREAD

**Issue by captify-msladkiy** [skoobe/riofs#86]
**Distro**: 3.14.19-17.43.amzn1.x86_64 (AMI)
**riofs version**: 6.2
**Libs**:
- glib2-devel-2.36.3-5.16.amzn1.x86_64
- libxml2-devel-2.9.1-3.1.32.amzn1.x86_64
- libxml2-2.9.1-3.1.32.amzn1.x86_64
- libevent-2.0.21-stable (installed as mentioned [here](https://github.com/skoobe/riofs/wiki/Centos))

// libmagic 
- file-devel.x86_64 0:5.19-7.24.amzn1
- file-libs.x86_64 0:5.19-7.24.amzn1 
- file.x86_64 0:5.19-7.24.amzn1 

**Compilation options:** ./configure --with-libmagic=/usr/lib64 --enable-debug
- part_size = 5242880  //can be any above 5mb

Uploading files with size >=  part_size does not work. Here the last part of uploading process. AWS responds with 400 (Bad Request) code:

12:10:16 [dir_tree](dir_tree_on_buffer_written_cb dir_tree.c:1445) [ino: 155, fop: 0x1601a50] Buffer written, count: 4096
12:10:16 [fuse](rfuse_write rfuse.c:732) [ino: 155, fi: 0x7fffaae63230] write inode, size: 4096, off: 5234688
12:10:16 [dir_tree](dir_tree_file_write dir_tree.c:1499) [ino: 155, fop: 0x1601a50] write inode, size: 4096, off: 5234688
12:10:16 [fio](fileio_write_buffer file_io_ops.c:676) [ino: 155] Write buf size: 5238784
12:10:16 [cmng](cache_mng_store_file_buf cache_mng.c:419) [ino: 155] Written [5234688:4096] bytes, result: OK
12:10:16 [fuse](rfuse_write_cb rfuse.c:717) [req: 0x1607950] write_cb  success: YES
12:10:16 [dir_tree](dir_tree_on_buffer_written_cb dir_tree.c:1445) [ino: 155, fop: 0x1601a50] Buffer written, count: 4096
12:10:16 [fuse](rfuse_write rfuse.c:732) [ino: 155, fi: 0x7fffaae63230] write inode, size: 4096, off: 5238784
12:10:16 [dir_tree](dir_tree_file_write dir_tree.c:1499) [ino: 155, fop: 0x1601a50] write inode, size: 4096, off: 5238784
12:10:16 [fio](fileio_write_buffer file_io_ops.c:676) [ino: 155] Write buf size: 5242880
12:10:16 [cmng](cache_mng_store_file_buf cache_mng.c:419) [ino: 155] Written [5238784:4096] bytes, result: OK
12:10:16 [con](http_connection_acquire http_connection.c:174) [con: 0x15fbd90] Connection object is acquired!
12:10:16 [con](http_connection_make_request http_connection.c:814) [con: 0x15fbd90] POST /path/to/bucket/mb5.txt?uploads  bucket: bucket, host: bucket.s3.amazonaws.com, out_len: 0
12:10:16 [con](http_connection_on_responce_cb http_connection.c:464) [con: 0x15fbd90] Got HTTP response from server! (38msec)
12:10:16 [con](http_connection_release http_connection.c:183) [con: 0x15fbd90] Connection object is released!
12:10:16 [con](http_connection_acquire http_connection.c:174) [con: 0x15fbd90] Connection object is acquired!
12:10:16 [con](http_connection_make_request http_connection.c:814) [con: 0x15fbd90] PUT /path/to/bucket/mb5.txt?partNumber=1&uploadId=qVoGn5yZyFyUgck.gCLI6PTMmo.xu_k7n9vo6sjU0_qOfU6Vda3iVA4IvxDWAsMvo0hEiKEEYj5vdNngarp3bONYkIcE4xlOq8RM8EV7sKo9eHZRS1BONZZvFmeZRrer  bucket: bucket, host: bucket.s3.amazonaws.com, out_len: 5242880
12:10:17 [con](http_connection_on_responce_cb http_connection.c:464) [con: 0x15fbd90] Got HTTP response from server! (297msec)
12:10:17 [con](http_connection_release http_connection.c:183) [con: 0x15fbd90] Connection object is released!
12:10:17 [fuse](rfuse_write_cb rfuse.c:717) [req: 0x1607950] write_cb  success: YES
12:10:17 [dir_tree](dir_tree_on_buffer_written_cb dir_tree.c:1445) [ino: 155, fop: 0x1601a50] Buffer written, count: 4096
12:10:17 [fuse](rfuse_flush rfuse.c:1047) [0x15fe340][req: 0x15fb980] flush ino: 155
12:10:17 [fuse](rfuse_flush_cb rfuse.c:1033) [req: 0x15fb980] flush_cb  success: YES
12:10:17 [fuse](rfuse_release rfuse.c:676) [ino: 155, fi: 0x7fffaae63230] release  inode, flags: 32769
12:10:17 [dir_tree](dir_tree_file_release dir_tree.c:1361) [ino: 155, fop: 0x1601a50] dir_tree_file_release
12:10:17 [fio](fileio_release_on_part_con_cb file_io_ops.c:322) [ino: 155, con: 0x15fbd90] Releasing fop. Size: 0
12:10:17 [fio](fileio_release_on_part_con_cb file_io_ops.c:359) Guessed MIME type of /path/to/bucket/mb5.txt?partNumber=2&uploadId=qVoGn5yZyFyUgck.gCLI6PTMmo.xu_k7n9vo6sjU0_qOfU6Vda3iVA4IvxDWAsMvo0hEiKEEYj5vdNngarp3bONYkIcE4xlOq8RM8EV7sKo9eHZRS1BONZZvFmeZRrer as application/x-empty
12:10:17 [con](http_connection_acquire http_connection.c:174) [con: 0x15fbd90] Connection object is acquired!
12:10:17 [con](http_connection_make_request http_connection.c:814) [con: 0x15fbd90] PUT /path/to/bucket/mb5.txt?partNumber=2&uploadId=qVoGn5yZyFyUgck.gCLI6PTMmo.xu_k7n9vo6sjU0_qOfU6Vda3iVA4IvxDWAsMvo0hEiKEEYj5vdNngarp3bONYkIcE4xlOq8RM8EV7sKo9eHZRS1BONZZvFmeZRrer  bucket: bucket, host: bucket.s3.amazonaws.com, out_len: 0
12:10:17 [con](http_connection_on_responce_cb http_connection.c:464) [con: 0x15fbd90] Got HTTP response from server! (13msec)
12:10:17 [con](http_connection_on_responce_cb http_connection.c:591) [con: 0x15fbd90] Server returned HTTP error: 400 (Bad Request). AWS message: Metadata cannot be specified in this context.
12:10:17 ESC[1;31m[con]ESC[0m  (http_connection_on_responce_cb http_connection.c:602) [con: 0x15fbd90] Server returned HTTP error: 400 (Bad Request)! Retry ID: 1 of 20
12:10:17 [con](http_connection_make_request http_connection.c:814) [con: 0x15fbd90] PUT /path/to/bucket/mb5.txt?partNumber=2&uploadId=qVoGn5yZyFyUgck.gCLI6PTMmo.xu_k7n9vo6sjU0_qOfU6Vda3iVA4IvxDWAsMvo0hEiKEEYj5vdNngarp3bONYkIcE4xlOq8RM8EV7sKo9eHZRS1BONZZvFmeZRrer  bucket: bucket, host: bucket.s3.amazonaws.com, out_len: 0
12:10:17 [con](http_connection_on_responce_cb http_connection.c:464) [con: 0x15fbd90] Got HTTP response from server! (12msec)
12:10:17 [con](http_connection_on_responce_cb http_connection.c:591) [con: 0x15fbd90] Server returned HTTP error: 400 (Bad Request). AWS message: Metadata cannot be specified in this context.

Here is tcpdump for the last transaction:

12:10:17.050574 IP s3-3-w.amazonaws.com.http > 172.30.2.88.56243: Flags [P.], seq 613:874, ack 5243646, win 12518, length 261
E..-..@.9...6......X.P..Q.t.5..~P.0..y..HTTP/1.1 200 OK
x-amz-id-2: B9ieEDV3tog9S13SqF0dz/1nOG7aJFnTR4I6rQUF2jWERT6VuianyRZtt9xJYclshUjugHPucSw=
x-amz-request-id: 89FA79C5B1751767
Date: Tue, 02 Dec 2014 12:10:17 GMT
ETag: "307b5d0f44a883bc2489d9bca9c2054b"
Content-Length: 0
Server: AmazonS3

12:10:17.051306 IP 172.30.2.88.56243 > s3-3-w.amazonaws.com.http: Flags [P.], seq 5243646:5244184, ack 874, win 229, length 538
E..B..@.@.*....X6......P5..~Q.u.P...k...PUT /path/to/bucket/mb5.txt?partNumber=2&uploadId=qVoGn5yZyFyUgck.gCLI6PTMmo.xu_k7n9vo6sjU0_qOfU6Vda3iVA4IvxDWAsMvo0hEiKEEYj5vdNngarp3bONYkIcE4xlOq8RM8EV7sKo9eHZRS1BONZZvFmeZRrer HTTP/1.1
Authorization: AWS 
Host: s3.amazonaws.com
Date: Tue, 02 Dec 2014 12:10:17 GMT
Connection: keep-alive
Accept-Encoding: identify
Content-MD5: 1B2M2Y8AsgTpgAmY7PhCfg==
Content-Type: application/x-empty
x-amz-meta-date: Tue, 02 Dec 2014 12:10:17 GMT
Content-Length: 0

12:10:17.064385 IP s3-3-w.amazonaws.com.http > 172.30.2.88.56243: Flags [P.], seq 874:1550, ack 5244184, win 127, length 676
E.....@.9.P.6......X.P..Q.u.5...P...>I..HTTP/1.1 400 Bad Request
x-amz-request-id: C30B418B935B1A47
x-amz-id-2: vGhVPY+rh6dK7UFXYKna/IBHppsij1ZX80cUUPyM+/BRzs7fF9OuHYwo789ZnLo78Pm1wXj0n8w=
Content-Type: application/xml
Transfer-Encoding: chunked
Date: Tue, 02 Dec 2014 12:10:16 GMT
nnCoection: close
Server: AmazonS3

17e
<?xml version="1.0" encoding="UTF-8"?>
<Error><Code>InvalidArgument</Code><Message>Metadata cannot be specified in this context.</Message><ArgumentName>x-amz-meta-date</ArgumentName><ArgumentValue>Tue, 02 Dec 2014 12:10:17 GMT</ArgumentValue><RequestId>C30B418B935B1A47</RequestId><HostId>vGhVPY+rh6dK7UFXYKna/IBHppsij1ZX80cUUPyM+/BRzs7fF9OuHYwo789ZnLo78Pm1wXj0n8w=</HostId></Error>

12:10:17.064395 IP s3-3-w.amazonaws.com.http > 172.30.2.88.56243: Flags [P.], seq 1550:1555, ack 5244184, win 127, length 5
E..-..@.9.SR6......X.P..Q.xV5...P...O...0

.
12:10:17.064544 IP 172.30.2.88.56243 > s3-3-w.amazonaws.com.http: Flags [P.], seq 5244184:5244722, ack 1555, win 240, length 538
E..B..@.@.*....X6......P5...Q.x[P...k...PUT /path/to/bucket/mb5.txt?partNumber=2&uploadId=qVoGn5yZyFyUgck.gCLI6PTMmo.xu_k7n9vo6sjU0_qOfU6Vda3iVA4IvxDWAsMvo0hEiKEEYj5vdNngarp3bONYkIcE4xlOq8RM8EV7sKo9eHZRS1BONZZvFmeZRrer HTTP/1.1
Authorization: AWS
Host: bucket.s3.amazonaws.com
Date: Tue, 02 Dec 2014 12:10:17 GMT
Connection: keep-alive
Accept-Encoding: identify
Content-MD5: 1B2M2Y8AsgTpgAmY7PhCfg==
Content-Type: application/x-empty
x-amz-meta-date: Tue, 02 Dec 2014 12:10:17 GMT
Content-Length: 0

12:10:17.077474 IP s3-3-w.amazonaws.com.http > 172.30.2.88.56243: Flags [P.], seq 1555:2231, ack 5244722, win 127, length 676
E....&@.9...6......X.P..Q.x[5...P.......HTTP/1.1 400 Bad Request
x-amz-request-id: 4AE01055B0DDD53F
x-amz-id-2: Xh0wD5P5D7tapT1Vie5NwQiz77cGrT5V5tXV92g9EB2kU/Oer4FUZT6buMWhgsJ0PoUHjJ1/RzY=
Content-Type: application/xml
Transfer-Encoding: chunked
Date: Tue, 02 Dec 2014 12:10:16 GMT
nnCoection: close
Server: AmazonS3

17e
<?xml version="1.0" encoding="UTF-8"?>
<Error><Code>InvalidArgument</Code><Message>Metadata cannot be specified in this context.</Message><ArgumentName>x-amz-meta-date</ArgumentName><ArgumentValue>Tue, 02 Dec 2014 12:10:17 GMT</ArgumentValue><RequestId>4AE01055B0DDD53F</RequestId><HostId>Xh0wD5P5D7tapT1Vie5NwQiz77cGrT5V5tXV92g9EB2kU/Oer4FUZT6buMWhgsJ0PoUHjJ1/RzY=</HostId></Error>

12:10:17.077482 IP s3-3-w.amazonaws.com.http > 172.30.2.88.56243: Flags [P.], seq 2231:2236, ack 5244722, win 127, length 5
E..-.'@.9..C6......X.P..Q.z.5...P...K...0
